// UC1 - Creating a payroll service database, showing all the databases and using the payroll_service database to create table inside it.

// Creating a "payroll_service" database

mysql> create database employeepayroll_service;
Query OK, 1 row affected (0.87 sec)

mysql> show databases;
+-------------------------+
| Database                |
+-------------------------+
| addressbook_service     |
| addressbook_system      |
| employeepayroll_service |
| information_schema      |
| mysql                   |
| payroll_service         |
| performance_schema      |
| sys                     |
+-------------------------+
8 rows in set (0.06 sec)

mysql> use employeepayroll_service;
Database changed

// UC2 - Creating a employee payroll table in the payroll service database to manage employee payrolls.

mysql> create table payroll_service(
    -> id int unsigned not null auto_increment,
    -> name varchar(150) not null,
    -> salary double not null,
    -> start date not null,
    -> primary key (id)
    -> );
Query OK, 0 rows affected (6.45 sec)

// Displaying the table properties
mysql> desc payroll_service;
+--------+--------------+------+-----+---------+----------------+
| Field  | Type         | Null | Key | Default | Extra          |
+--------+--------------+------+-----+---------+----------------+
| id     | int unsigned | NO   | PRI | NULL    | auto_increment |
| name   | varchar(150) | NO   |     | NULL    |                |
| salary | double       | NO   |     | NULL    |                |
| start  | date         | NO   |     | NULL    |                |
+--------+--------------+------+-----+---------+----------------+
4 rows in set (0.57 sec)

// UC3 - Creating employee payroll data in the payroll service database as part of CRUD Operation.

mysql> insert into payroll_service(name,salary,start) values
    -> ('Bill', 1000000.00, '2018-01-03'),
    -> ('Teressa', 2000000.00, '2019-11-13'),
    -> ('Charlie', 3000000.00, '2020-05-21');
Query OK, 3 rows affected (0.47 sec)
Records: 3  Duplicates: 0  Warnings: 0

// UC4 -  Retrieving all the employee payroll data that is added to payroll service database.

mysql> select * from payroll_service;
+----+---------+---------+------------+
| id | name    | salary  | start      |
+----+---------+---------+------------+
|  1 | Bill    | 1000000 | 2018-01-03 |
|  2 | Teressa | 2000000 | 2019-11-13 |
|  3 | Charlie | 3000000 | 2020-05-21 |
+----+---------+---------+------------+
3 rows in set (0.03 sec)

// UC5 -  Retrieving salary data for a particular employee as well as all employees who have joined in a particular data range from the payroll service database.

// Retrieving salary data for Bill

mysql> select salary from payroll_service where name='Bill';
+---------+
| salary  |
+---------+
| 1000000 |
+---------+
1 row in set (0.03 sec)

// Retrieving salary data for all employees who have joined from 1st Jan, 2019

mysql> select * from payroll_service where start between cast('2019-01-01' as date) and sysDate();
+----+---------+---------+------------+
| id | name    | salary  | start      |
+----+---------+---------+------------+
|  2 | Teressa | 2000000 | 2019-11-13 |
|  3 | Charlie | 3000000 | 2020-05-21 |
+----+---------+---------+------------+
2 rows in set (0.07 sec)

// UC6 -  Adding Gender to Employee Payroll Table and Update the Rows to reflect the correct Employee Gender.

// Adding gender as a column to the table
mysql> alter table payroll_service add gender char(1) after name;
Query OK, 0 rows affected (4.12 sec)
Records: 0  Duplicates: 0  Warnings: 0

// Retrieving all the data from the employee_payroll table

mysql> select * from payroll_service;
+----+---------+--------+---------+------------+
| id | name    | gender | salary  | start      |
+----+---------+--------+---------+------------+
|  1 | Bill    | NULL   | 1000000 | 2018-01-03 |
|  2 | Teressa | NULL   | 2000000 | 2019-11-13 |
|  3 | Charlie | NULL   | 3000000 | 2020-05-21 |
+----+---------+--------+---------+------------+
3 rows in set (0.00 sec)

// Updating the Rows to reflect Female as gender 

mysql> update payroll_service set gender='M' where not name='Teressa';
Query OK, 2 rows affected (0.08 sec)
Rows matched: 2  Changed: 2  Warnings: 0

// Retrieving all the data from the employee_payroll table


mysql> select * from payroll_service;
+----+---------+--------+---------+------------+
| id | name    | gender | salary  | start      |
+----+---------+--------+---------+------------+
|  1 | Bill    | M      | 1000000 | 2018-01-03 |
|  2 | Teressa | F      | 2000000 | 2019-11-13 |
|  3 | Charlie | M      | 3000000 | 2020-05-21 |
+----+---------+--------+---------+------------+
3 rows in set (0.04 sec)


// UC7 - Finding sum, average, min, max and number of male and female employees.

// Retrieving maximum salary of each gender. 

mysql> select gender,max(salary) from payroll_service group by gender;
+--------+-------------+
| gender | max(salary) |
+--------+-------------+
| M      |     3000000 |
| F      |     2000000 |
+--------+-------------+
2 rows in set (0.78 sec)

// Retrieving minimum salary of each gender. 

mysql> select gender,min(salary) from payroll_service group by gender;
+--------+-------------+
| gender | min(salary) |
+--------+-------------+
| M      |     1000000 |
| F      |     2000000 |
+--------+-------------+
2 rows in set (0.02 sec)

// Retrieving sum of all salaries of each gender

mysql> select gender,sum(salary) from payroll_service group by gender;
+--------+-------------+
| gender | sum(salary) |
+--------+-------------+
| M      |     4000000 |
| F      |     2000000 |
+--------+-------------+
2 rows in set (0.03 sec)

// Retrieving the count of all employess of each gender

mysql> select gender,count(name) from payroll_service group by gender;
+--------+-------------+
| gender | count(name) |
+--------+-------------+
| M      |           2 |
| F      |           1 |
+--------+-------------+
2 rows in set (0.05 sec)

// Retrieving average of all salaries of each gender

mysql> select gender,avg(salary) from payroll_service group by gender;
+--------+-------------+
| gender | avg(salary) |
+--------+-------------+
| M      |     2000000 |
| F      |     2000000 |
+--------+-------------+
2 rows in set (0.04 sec)

// UC8 - Extending employee_payroll data to store employee information like employee phone, address and department.

// Adding phone_number as a column to the table

mysql> alter table payroll_service add phone_number varchar(250) after name;
Query OK, 0 rows affected (3.59 sec)
Records: 0  Duplicates: 0  Warnings: 0

// Adding address as a column to the table and set 'TBD' as a default value

mysql> alter table payroll_service add address varchar(250) default 'TBD' after phone_number;
Query OK, 0 rows affected (3.90 sec)
Records: 0  Duplicates: 0  Warnings: 0

// Adding department as a column to the table and making it not null 

mysql> alter table payroll_service add department varchar(150) not null after address;
Query OK, 0 rows affected (2.08 sec)
Records: 0  Duplicates: 0  Warnings: 0

// Descibing the structure of the table

mysql> desc payroll_service;
+--------------+--------------+------+-----+---------+----------------+
| Field        | Type         | Null | Key | Default | Extra          |
+--------------+--------------+------+-----+---------+----------------+
| id           | int unsigned | NO   | PRI | NULL    | auto_increment |
| name         | varchar(150) | NO   |     | NULL    |                |
| phone_number | varchar(250) | YES  |     | NULL    |                |
| address      | varchar(250) | YES  |     | TBD     |                |
| department   | varchar(150) | NO   |     | NULL    |                |
| gender       | char(1)      | YES  |     | NULL    |                |
| salary       | double       | NO   |     | NULL    |                |
| start        | date         | NO   |     | NULL    |                |
+--------------+--------------+------+-----+---------+----------------+
8 rows in set (0.26 sec)

// Retrieving all the entries of the table

mysql> select * from payroll_service;
+----+---------+--------------+---------+------------+--------+---------+------------+
| id | name    | phone_number | address | department | gender | salary  | start      |
+----+---------+--------------+---------+------------+--------+---------+------------+
|  1 | Bill    | NULL         | TBD     |            | M      | 1000000 | 2018-01-03 |
|  2 | Teressa | NULL         | TBD     |            | F      | 2000000 | 2019-11-13 |
|  3 | Charlie | NULL         | TBD     |            | M      | 3000000 | 2020-05-21 |
+----+---------+--------------+---------+------------+--------+---------+------------+
3 rows in set (0.00 sec)

